user_id,comment_text,date_created,num_likes,num_replies
100003890425484,"One of the worst customer services I have ever seen.
I wanted to transfer my billing responsibility from my employer's business account to my consumer account. The admin from my employer's account spoke to the ATT and initiated a release from his side. He then asked me to call 611 to initiate the transfer of responsibility from my side.
I called 611 on 7th May 2024 and gave all the details the representative asked for. After almost an hour, the representative said the transfer had been initiated. Since I did not get any intimation, I called again in the evening and learned that the previous representative had entered my email ID incorrectly. After an hour, the new representative told me that the transfer would be complete in the next 48 hours.
The transfer did not happen in 48 hours. I again called back. There was a call drop a couple of times after waiting for 10-15 minutes, and then a representative picked up the call. After listening to my story, she asked me to call another department. The guy in this department wasted another 1.5 hours of my time. He asked me to pay off my pending balance on the phone and told me that the transfer would happen in 24-48 hours. 
The transfer did not happen even after 72 hours. I called back. Again there were a couple of call drops. Finally, a representative picked up the call and said she could not speak on behalf of previous representatives or check the previous transfer requests. However, she could assure that the transfer will be complete this time. Again I spent an hour with her on the phone. In between, she asked me to add my employer to the line to grant the permission. Ultimately, she told me the transfer would be complete in 48 hours, and she had scheduled a call back to confirm the transfer. 
Neither the transfer happened in 48 hours, nor did I recieve a call back from ATT. I called again, explaining the whole story to a new representative. She asked me to add my employer on line for the consent. She then told me that the transfer was done from the business department and wanted to connect me with the consumer department. She put my call on hold which went almost for 1.5 hours. And finally, she had to disconnect as nobody picked up the call from the consumer department.
Then, I myself called the consumer department and a lady named Sheena could help me transfer the line. 
Throughout this entire ordeal, I've dedicated a significant amount of my time, approximately 8-10 hours, engaging with various representatives. Despite my repeated attempts, there seems to be a lack of accountability and a clear process to handle multiple queries on the same request. The waiting time for a call to connect is seemingly infinite, adding to my frustration.

Since I have paid off for my phone, I wanted to unlock the device. I tried doing it online to see a note: ""Please try after 60 days"". Per the policy, the device can be unlocked after 48 hours of payoff. The reason was that since my consumer account is new, it takes 60 days. My question was, if they treated the business and consumer departments as different entities, how did the business account still lock my phone even after I paid it off? Should they not unlock before releasing the phone to a different entity? Is there no checklist in place? And is it legal for a consumer entity to get a phone that is already locked by someone else? I don't know whom to ask. Because, as usual, customer care representatives have no answers.","""2024-05-17T02:55:13.000Z""",0,2
pfbid02LgBAVpG4zxSLJ2ZoqrKken5goJVgsUAofBMpdFAArB82dXcEpbHpAwLT9GvmotL6l,Amanda Cromby,"""2024-01-11T22:59:27.000Z""",0,2
pfbid0nLGr4bBJPp5rCQRGFQrWaaeZLinxXM9Cp6Uxbe8Lm3GS7u3kKKZDyNzVrpLTYNfgl,My phone is not working,"""2023-03-29T20:56:28.000Z""",0,2
673977859,"ATT has the worst customer service perhaps of any company in the world.   The use of offshore -meaning Phillipines based operators given little power to help is only complicated by hours on hold, dropped calls constantly, no one ever calls you back.","""2024-01-30T23:17:38.000Z""",0,2
pfbid0XrmxSgXk1zkmHVw5KxBVGixeWvvCdBfHfivQXr1PsVnc52CFxkTtKwgLpiLKCsPPl,"Been with them since I was old enough to have a phone. I am 21 now. Everything about their service is horrendus. Long waits, and then when you finally get to talk to someone other than a bot you're stuck in the same postion because ""no one can help. It's pitiful. You don't go on other companies pages and see stuff like this. Once you get in with them it's like jail. I've been trying to unlock my carieer for a week now and it's still one thing after the other. I just want out from this company who charges a 21 yr old $80-$100 just for one month ,one phone plan. Absurd. I can't wait to start with boost mobile, not only do i get a free iphone 11, it's literally $25 a month for 8gb's. Instead of $80 a month for 4 GB. ABSURD. Treat their loyality customers like crap. Even before I had my own plan and was on my parents they had issues it seems like every month. I AM NOT A SLAVE TO At&T I just want to be free🦋","""2023-01-26T21:49:29.000Z""",0,2
pfbid0mzWMmua6Mtv5sdtjn7zBptRJ8ECdQGZA7GvSXs75BWmXy9EyT9rHEBuH98gkMkAil,"Yes, they have become very transparent in their views and dump them when you can!!!  They are not serving their customers.","""2023-02-23T05:45:10.000Z""",0,2
pfbid029FGesd25o6RumPNVgJC7osLdQaVgmb9RPzNorh7WnC8PS8tGV4WQKUm5pgA5guB6l,Why's my service out and no public explanation???,"""2024-02-22T15:43:57.000Z""",0,2
pfbid02f4wVjUWdKH9fixcQ9RQQjkWhE1GU3LnMU3HRcs85eRzZDaXv8DZRL82i8KbVV52El,"I just ""upgraded"" my plan and now I have 4G almost everywhere, sometimes no service, in places I used to have 5G... 🙄  Glad I get to pay more I guess...","""2024-02-21T03:14:40.000Z""",0,2
pfbid0xcfqZMnYDnPzqiMH968yqVxjsgAgF6WuTafwcya5DVufwuHzHbMbmKKNe5X6D79Ml,"Tammy Leggett Shuman conversations through FB, text, snap, IG, TikTok 🤣🤣🤣","""2024-01-12T12:49:48.000Z""",0,2
pfbid02yhMaPETuqKoXEVj6ennbwgsffYrsUz3JEYRGaonGe936wRUKKyd27LRARScTpv9xl,"Why can I not get my tech issue resolved. I have called over 100 regarding the tech  issue and after 3hrs the person disconnects and never calls back.  Clearly you do not value business that has been with you for
Over 15 years.","""2024-01-19T02:38:55.000Z""",0,2
100001471408034,👎🏽👎🏽👎🏽👎🏽👎🏽👎🏽👎🏽👎🏽👎🏽👎🏽,"""2024-02-07T03:44:44.000Z""",0,2
pfbid0MUovRaRzquQyfimaPjC1624T3EggvpAqhJfdqA5EneFdXUFfpMuhXWQEmKhTZj91l,"At&t is the worse company ever. My internet only works in half the house. I call you all, and after waiting 30 minutes the rep says ""disconnect the modem, ??"" I am like, wont that drop the call? Which of course it does, and she had promised they would call back if that happened , yeah right 😂. Now i cannot even reach their website to make a payment, which they had the nerve to raise by 5.00 of course. This is after they breeched our info and they can't even provide good internet in my house. Worst customer service ever !!!!!!! Luckily i have a choice and will switch to Spectrum, had nothing but issues with AT&T since i signed up.","""2023-03-26T20:10:49.000Z""",0,2
pfbid0oCBYZyTCpbt28En9pSwUzzZhpFJCozLKqMUavN72sEcsY98AGTPZH8tm62g2et64l,"After another hour of hell with your social media team, they informed me my ticket from January 22 was closed. I was not made aware of this, never communicated on the resolution. It still isn't resolved on my end, but somehow verizon closed the ticket, didn't communicate that to the customer, while the customer was still charged for the month they were assured they wouldn't be charged by 3 diffrent agents on Dec 6, 11, 17/17 while in veirzon store next to the physical associates. What in the world?? how is this customer support??? how can I sue them anyone please heeeelp","""2024-02-05T15:53:45.000Z""",0,2
pfbid02nsBLVVEFrTMZG9kKBARGMg5Ftfkif5GxfsiWoe8K1G4P5k7FgwsShRCy947hW7Lol,Verizon I have sent you a message about our number port out being refused.,"""2024-01-20T18:02:57.000Z""",0,2
pfbid02Hvqaz86tWa4pvpUKz4afmEkbcm2yHr5cW4NtTgadY9h5P6qYyvnnAScY3W4jxWkAl,"I just want to upgrade to a “ free “ 
iPhone 15 pro max","""2023-11-27T20:06:14.000Z""",0,2
100066919696770,2024 no service,"""2024-01-31T20:41:32.000Z""",0,2
pfbid0MUovRaRzquQyfimaPjC1624T3EggvpAqhJfdqA5EneFdXUFfpMuhXWQEmKhTZj91l,"At&t is the worse company ever. My internet only works in half the house. I call you all, and after waiting 30 minutes the rep says ""disconnect the modem, ??""  I am like, wont that drop the call?  Which of course it does, and she had promised they would call back if that happened , yeah right 😂.  Now i cannot even reach their website to make a payment, which they had the nerve to raise by 5.00 of course. This is after they breeched our info and they can't even provide good internet in my house. Worst customer service ever !!!!!!!  Luckily i have a choice and will switch to Spectrum, had nothing but issues with AT&T since i signed up.","""2023-03-26T20:09:53.000Z""",0,2
pfbid0KaHhbEzyVkuaGqfmi5vFvNRUbrjUjigG9XbHss8M86DjBDGXkve1aoLaoMWvgfSml,So I check my bank account today to find out ATT has charged my business account that I’ve had with them for umteen years almost 3000.00!!!!!!!!   What????  So after 2.5 hours on the phone and 2 phone calls later ( the first guy left me on hold for 1.5 hours before hanging up on me ) they saw “ their” mistake and will refund my money…… in 3-5 biz days.  Meanwhile I’m out countless overdraft fees and have other bills to pay.    They get a large amount from me every month as it is for like 12 or more years.  I’m thinking I may need to make a change,"""2024-01-17T22:40:13.000Z""",0,2
pfbid0KuwsvxVWSd4R4m1izsAQx2PauvhrZfxbC5NeMNVHokRGuVsuyAF5axbQEgU7BBm9l,If Lebron James is the spokesperson for at&t I will go to any service but at&t,"""2022-10-15T23:30:37.000Z""",0,2
100001815678243,My service is out causing me major problems today!!! AT&T better give me a couple free months at least. This cost me way more!!!,"""2024-02-22T16:07:33.000Z""",0,2
pfbid02v9AdebXR5JKRsyt694mSH1wEVnosbpj6HcWjyqBY87F7NjRAx2gA4rmhmzZmh2sUl,"Not me thinking the third option was going to be ""if you wanna beep me it's okay.""","""2024-01-11T22:49:08.000Z""",0,2
pfbid02HD7uKU9t2nfJu1hGoTb5TscPzHMC5D6syJyTH7TEWwf42idrbcmt3VefovwTHguHl,"Twice since I got a S23...call immediately disconnects, and text messages will not go through. I want my S10 back!!!","""2024-01-20T14:34:50.000Z""",0,2
pfbid035PiVNJYA9oi6f9z9hjrfhj1XTPVEcH7L73pyfB4Lrp2taiavCD4dAPND8TJ8HZvPl,Not our town. Verizon quit working on one side. Been a year now…,"""2024-01-12T13:29:22.000Z""",0,2
pfbid0mmjEYxdMuG4jBx2B1pvDpDsT9jaUjrTFsDc5aZ9uGtPZ5WV4YdFWDpF53BRNNqQTl,Randi McCollum,"""2024-01-15T15:45:24.000Z""",0,2
pfbid02nPz9cFwUXWsabdECj5eowmomv7MZeGiJz7jvFjeQMvfmBumZnsGanoMAphdjAFCnl,Watts Towers in this. Learned about them on Reading Rainbow. So cool.,"""2023-10-02T00:15:49.000Z""",0,2
pfbid02t4GiKUg1D13986RM7bZ7nRgeP6XQphkNTEDcqWCXD4KNhR3ukLqQTvzegTPNysBLl,Madisyn Tolbert,"""2024-01-17T15:23:45.000Z""",0,2
pfbid0rxbvBJvTZXVAznoLeKbPadjwphv6smgPjTK2XS51yKRjrpqooXfNA6NoeWKc9sFol,"Seeing how you portray men in your commercials, I am glad I have AT&T.","""2024-01-14T14:34:55.000Z""",0,2
pfbid02NnARexfE9dYwRa65CTVcUrB2s6wtQAFKGpML5MJnRHyji4mqKAABSfCjCt262dhCl,Kerrie 🤣 that’s us,"""2024-01-11T21:39:30.000Z""",0,2
pfbid02ENkydgvAgDRBFi8BoBiQtAT6U5S8APUCSmRr9efURwLzhTYGQTMbpuyynaxHVXPQl,Jenelle Kirkpatrick,"""2024-01-11T23:00:45.000Z""",0,2
pfbid0whbQ5dLyCKHzGqtaT24frWehNmFs6K8Du8KNDmjvPTQeYNXPiZWYsRa6eKAM6V7rl,I AM SO GLAD I CANCELLED THIS SERVICE!!!! CUSTOMER SERVICE WAS ALWAYS HORRIBLE SERVICE HORRIBLE INTERNET HORRIBLE!!!! I WAS WITH THIS COMPANY FOR 10 YEARS AND LEAVING WAS THE BEST DECISION EVER ESPECIALLY FINANCIALLY,"""2024-02-22T18:16:08.000Z""",0,2
pfbid0fjbriSb1PSjtFV36EDHHnri6dtP5aHi2noPLW81hLbMkBbjXz3bxUg6zGRy6s8Drl,Why do you increase charges each month. Thus month increased by .09 per line.,"""2024-01-21T16:21:58.000Z""",0,2
pfbid031CPwuzdPatoqZYZmZiK3SFeQnQy6xggkGfQ7jPcFy7cjCTksxmrQfCcuQHTEAopwl,It’s like Groundhog Day calling your customer service. I’ve been trying for over a week to get an email to return or old phones. I’ve invested over 10 hours into it and trying to access my account all because the sales person entered the wrong email address when our account was set up. Where can I find a confident business representative from AT&T to help get this solved?,"""2024-01-09T18:07:50.000Z""",0,2
pfbid02nPmTQcnpqJk8x5e1L2Xg3eUJACJGAus5vzvxJT9BNqpMg65FeHGtsu3ZHqfgTMSbl,"Just left Verizon after 20 years and joined AT&T only to find out that they don’t care about their customers. Signed up through a promotion at Sam’s club to cut my bill in half and get free iPhone 15s. Only to not receive the boxes to send my phones back in then find out that they had to be returned within 30 days which I was not old but still didn’t receive the boxes. Called customer service went to two different stores only to be told that they couldn’t help me. Then they tell me that the people in Sam’s club are third party and don’t represent them yet they know that they have many problems with this issue. Now I am stuck until I pay these phones off. This is the worst mistake that I had ever made. Unless one thing changes, I will never recommend this company to anyone.","""2024-03-29T21:20:15.000Z""",0,2
pfbid02njryH9JTVSZfJJU1nFnTaaTUnMWDoLXgFBGiecqsabB9QDRY6P54TvGmtzMrtvVvl,"I wrote a post today i did not see it on your site, my account ending in 6870 was paid in the amount of $214.51 cleared the bank and went through your bank on 4-18-2023. if you can not find it call me 770-387-1600","""2023-04-21T17:10:44.000Z""",0,2
207000700,Helloooo!!!  👋🏾  Customer of 10+ years here..... just experiencing more service issues!  😡  I'm being Over-Charged again and no one seems to understand how this keeps happening,"""2023-12-22T00:33:25.000Z""",0,2
pfbid0Un7EB7nTCvkL5nUGaJoUQGddw8YtNQ493FrwWZbgBrr8xzWkrA7ujHoihSB9hoNHl,"AT&T, trying to reach a manager in the United States to resolve my billing issue. I’ve called your 800# multiple times & I keep getting connected to someone offshore. Hard to understand. They say they can’t connect me to anyone in the States. WTH? Tried to chat feature and got disconnected twice. What is going on there? I’m a 30+ year LOYAL customer. Need to talk to a manager…IN the United States!! Getting very close to cancelling my service. 

A very frustrated loyal customer!","""2023-12-11T23:50:55.000Z""",0,2
pfbid0fYTkEXxtreYTq4ofWyeb6FhHsCPWwV958P13z5qcW7AH4xNDcJCC7wc6JijhYSytl,They also charged me 3x for two different devices duplicated fees amounting nearly 200$,"""2024-01-27T18:59:36.000Z""",0,2
pfbid0PtpKkAMyB5ZVZVo8FrsxD618WPaHEzb6HQNSWVG9QXHfEKb6pqJqZLwf7QQi5Dxml,Criminal organization.  They have turned into a corporation of scams.,"""2023-03-23T13:20:17.000Z""",0,2
pfbid02Lo4DcaosVHjVN1Dpg4MbtxGYoRhf4deUbR488kHzvvCW8g9euntnroaa2rbYJvXAl,"So is this $5 going to per line? I have 6 lines on my account, so the credit better be for $30!","""2024-02-27T09:32:09.000Z""",0,2
pfbid0359JQGnZ1SqzTiDruuXQHnMuWMah9nfkZwzGy9Wbd9qHK9ycxhw4u2gwNkEPqYFaql,"Over the past month, I have encountered numerous issues with both AT&T and DirectTV. Despite my repeated attempts to seek assistance, I have been met with indifference, incompetence, and a complete disregard for my concerns.

It is utterly unacceptable for a company of your stature to treat customer of over 15 years with such disrespect and negligence. Customer service is the cornerstone of any successful business, yet it appears to be a concept foreign to AT&T! Your inability to address and resolve even the simplest of issues reflects poorly on your company's values and commitment to customer satisfaction.

I have cancelled my DirectTV account and will be canceling my Mobile service with AT&T and moving my  family to a company that values our business. 

They are a joke of a company and I will advise anybody I know to stay as far away from them every chance I get.","""2024-03-13T07:33:57.000Z""",0,2
pfbid02oCqWqCinoHgb8nyVrwWzWk2qXBVWQbLYA2T8U8WiX1iZQYcvj5QF3KQfhNSUGfFsl,Can't have ANY conversation when NOTHING works!!!!!,"""2024-01-31T00:19:54.000Z""",0,2
pfbid0RvDaG2hhB1mwU8QyyPehxAEbMnGyqmzYrNT5r4S3Wy6uRzUPKpq1pioejtXjNp5Kl,We want newsmax!!,"""2023-01-30T02:07:30.000Z""",0,2
pfbid02ZU3HtYB7R5MCoySqwRFRCc5n3H4o7mikbUJ3GDrRA4fPWAbZCGxeEp47L4hivUptl,Massive outage today. When will service be back? Negatively affecting day to day operations for people with ATT!,"""2024-02-22T16:10:42.000Z""",0,2
pfbid02xy6Gg32EPqLBpXppHWtaHzBPtRVL7PBw5UbLZw24GbRnYRekeCWaBGA1Mbxx9ZxZl,"Single father, travel for the military, a lot. My phone is my lifeline and how I keep in contact with my child and units I work with. 

Having a issue between AT&T and Samsung. 

My S23 randomly accepts calls/texts and sends. 

Advised I have to send my phone in for up to 2 weeks. Find a friend or loaner on my own dime and get compensation of 50$ for my time. 

Or drive over an hour to a Samsung repair shop... but wait... there's more....

Best thing about this. Their tech team had me take my phone to a repair shop who recommended replacement. Now Samsung is saying they never said that and the repair shops statement is not valid.

Oh, ya. Or pay 300$ to upgrade to the S24. 

Or pay AT&T 300$ for a replacement phone.  

Neither AT&T nor Samsung are willing to admit the issue. Google and check reddit. The S22 Ultra series and multiple S23 are having this issue. 

I've done every check their advanced tech team requested me to. 

They're putting the financial burden on the consumer for a software/network issue they didn't cause. 

Kora R. | Extra care
Samsung Electronics America, Inc.
55 Challenger Road, Ridgefield Park, NJ 07660
(Telephone) 888-480-5675 opt#1 allow prompt to request ext. 34248| (Fax) 973-529-0367

Advised me I have no other choice but to find a loaner or go 2 weeks without a phone. Talk about customer service.","""2024-02-13T16:42:29.000Z""",0,2
pfbid02mkkC59aKxHxQjL6S3FEvkh8gRSZb4eMhzJDCuYiZJ4gEqbVLSrS8wWZXysyEcre8l,Marie Mesher 😂,"""2024-01-19T20:50:14.000Z""",0,2
pfbid02xDWuVwF48nFzaXeckdroq34LUoi9A2k4aEVCneBJHZeibtd8A4zDE61TBPXjF1PBl,Love it. Where's my edibles. Lol,"""2022-04-18T18:58:59.000Z""",0,2
pfbid02aFaeX3u8YYacqSRvaAB69WTRY6ioKFojf2TNKMptcZ8TTNtjMffJorhW3YsaYwKil,Great job on the data breach.,"""2023-03-17T02:15:34.000Z""",0,2
pfbid02RAeCVBJZAKpfXTCvJK8QWaYJtUWajMT6haSmEpBt3fMGqZUuFUZFo6JhMeykcGg3l,"What the hell happened yesterday when you dropped the ball and all your customers nationwide had no use of their phones? This is enough to send us all to a competitor. 
You need to send out a personal apology to everyone  and a free month- waive their bill for a month and don’t let it happen again . People could not communicate,￼ make calls text and worst of all - NO driving directions for work in congested cities -shame on you.! 
don’t be playing a false flag for the government!! 😡","""2024-02-24T06:31:40.000Z""",0,2
pfbid02NWSJXmygTyxrYbxXX7cNyHgNVMyACWAtzwUxbr3k6dLHaV86ds3f6v1PNwePzkPzl,What is the email for att business support? I’m tired of spending hours upon hours on hold and being transferred. I’ve been fraudulently charge for 5g Mobile Wi-Fi for a year when your local rep found a 4g SIM card in the unit.,"""2022-12-06T23:48:31.000Z""",0,2
pfbid02DhDyd64emUDPDTMitqLFYsLURuhvmPoS6vB7wvUwahHtV4ThSnWYkdi49hAEpecyl,"text, email, teams chat and DM you never know, try to follow the conversation lol","""2024-01-13T14:46:13.000Z""",0,2
pfbid0Zq1Wrfz16N6eYDbA3bpgpTkngAZsHUe2ooFVS72wyyzsaZGNpNRRQwZ764F4WvkUl,What a disgust of service they have !!!!,"""2024-08-05T16:25:24.000Z""",0,2
pfbid02TTfEk2a3v9gA9rSaHrc6RGrbFmgzwS5QDUfs4ZkWm926hXB5Kx3AZhT5z6Bpcg96l,"ATT&T knows that the non-corporate stores are telling people lies and selling services based on ""it's a trial basis and you can cancel within 60 days if it doesn't work and not get charged"". Spent several physical trips to the non-corporate and then corporate store and then 1 1/2 hours on phone 1 time and then 2.5 hours second time on phone and just now on phone for 15 min. to find out NO ONE can do a thing about it. You all know these stores are lying and your employee at the corporate store even told us they knew the store we went to lied to people all the time ...YET ATT&T  DOES NOTHING ABOUT IT! We've been an ATT&T customer for over 15 years and this is how you treat us. Now I have to pay a bill for something that I only had 4 days and it didn't fix our problem (and by the way when we called and cancelled the service it shows that the person we talked to TOOK OVER 20 DAYS TO CANCEL IT!!)  We went to a Non-Corporate ATT&T store in Festus, MO to get lied to. We can complain to you all day long about this store but you won't do a thing about it. You just keep sending us on the phone to another department and another department.  I guess you think you will wear people down and they give up and pay your bill.  And we aren't even a business.....just regular consumers but the guy at that store said getting a business line would fix our problem.  I am so angry I can't even stand it. This is why people change over to T Mobile, Sprint or Verizon.... I guess this kind of behavior is usual business for you.","""2024-03-28T18:49:40.000Z""",0,2
pfbid0UST3qQHvFyF5Gh979khjPYC1SVw8pFGfT3RP2pHRHzQxJt1akUeCRzHGm9LfVtbel,You'll nothing but a bunch of LIERS,"""2024-01-20T00:07:25.000Z""",0,2
pfbid036Z6hzarCoCiXiN82jbJ27hf4GPcFBPMs9wpXqYAUSgeMy6jtTvouCaeqrWGA8zGrl,"Can I get someone who speaks coherent English to contact me to discuss our office at hand? Our account has been a cluster since the first day, almost three years ago. I have been called a liar by several AT&T employees bc THEY can’t find the account or have never heard of office at hand, which was apparently not set up correctly. For the first year and a half was trying to pay for the service itself! Like WHAT????? It’s a PHONE LINE! We want to keep the phone number that has been with our business for over 50 years, so to get to the bottom of this, it seems we need to change providers. As a business owner, myself, I thought AT&T, AT&T Business would care about their customers enough to keep them. 

I realize this isn’t the place to discuss all of this but when you’ve spent 3 years calling and going into the ATT stores and still nothing is resolved, that is a big problem! I will be waiting for someone to contact me, but you best believe I won’t be holding my breath. 🙄","""2024-11-06T22:44:35.000Z""",0,2
100046696456431,Get charged for 5G and there's like 4 places in town that we get 5G.  Charging my wife 5G when her phone is 4G. You're ripping people off.,"""2024-01-21T03:32:58.000Z""",0,2
pfbid0grN2id9Muw7WmrLSC1SY2NkzRpjb1tb8uc83nHdadgieGTQ3hvvCb2E8nSqacfhbl,ATT T mobile perfect reception why verizon is losing customers,"""2024-01-15T22:48:34.000Z""",0,2
pfbid0243jwWpZEjBT7zgZ4HdmjXZqxGVd5kcBSvxHa1XTnVc2nUxsDd4ZsRGSu8NWzzEr8l,0,"""2024-01-11T23:10:40.000Z""",0,2
pfbid0ojk8CYa57wT8989NmAYYW8x1BQpmjJs51nKveTmXg79uu2QhekZDhwY3LbD9nVgpl,how bout them ringbacktones Verizon   good times,"""2024-01-12T05:16:39.000Z""",0,2
pfbid0CNESDRshhQkQzxrmtc9nepQA92DR7E7f1LG3KRgVmbQNuKTWmUmxeTwWq8F49y97l,Where are the AT&T stored NOT the Franchise,"""2023-01-08T09:32:44.000Z""",0,2
pfbid0CmpeLSY84p5g7iuLxs7NmK7tHmeZSwDvtWmPZZFTHDEQ51CBMxFj51iQe3UYFiRgl,I am not connecting to my network in 34203.,"""2024-02-22T12:04:07.000Z""",0,2
pfbid028pUmYP49DaUVsxrHpqoaz4njEmwA3XWE8pRxu1uYhN8M1nPKCMBqC24aSDiy4KCdl,Verizon you are the problem,"""2024-01-12T00:18:11.000Z""",0,2
pfbid02G6aRWvkBCpRqRL3JYAvdBrEANA381uAKzCgMHiHfKJGwXZRWsvd7MtpfTn1w9Laql,"How about I add to this, this is a lawsuit waiting to happen. 2 terms come to mind. Breach of contract and theft by deception.","""2022-12-20T18:19:24.000Z""",0,2
pfbid02gkMZm26Vae1UCE8dfQiXx3zvBjK2ZYHk7sCrzYRavf54tDxJzec2XqGk4LV3Foh9l,"AT&t are the biggest crooks and fraudsters in the world. I have a recording from the AT&t rep that said our account is closed the next bill will have a zero balance. I have it recorded of course the bill that came is for over $400, the usual fraudulent bill. I'm calling the attorney general's office tomorrow I want them prosecuted I want you prosecuted you are such absolute crooks you don't deserve to do business with anyone I hope you don't get your application granted to stop landlines you don't deserve any consideration at all. You are the biggest crooks in the world","""2024-03-05T03:46:41.000Z""",0,2
pfbid02i16A9EPViTgKwrtAC48GE1XELLZkWtNL1VCd6pDEJdwSY1NTzMBD5MfCioBjaQ76l,"Horrible service, do not use them. Snake oil salesmen","""2023-12-29T00:37:59.000Z""",0,2
pfbid0BLvznchBRwSZXEf23bUHui1ecs9gjgPZnWGsBDBnypV9eRLaQmitAWTAdvUjjbidl,Pretty cool how people who are struggling and can't afford a contract aren't important enough to compensate when YOUR COMPANY FAILS to deliver service. Also cool when those same people go to another pay as you go carrier,"""2024-02-26T14:50:42.000Z""",0,2
pfbid0BizW7Z9exptwa2uRHaTK3CWkLom6vCCspmtZvHV7rDhGpdj7Nzas4KFMtuBNMiYRl,You have come very far,"""2024-02-23T01:31:32.000Z""",0,2
pfbid0GZzN525mf5UMf4NYW4eTCvQ9hAM59J9HL9weeBAkaYe3HSeJmVpqpmtCjJNW5eTnl,I just got a notice from AT&T saying that they're gonna raise their rates and stop giving the discounts that they promised us. Yet they're gonna still give illegal aliens everything free as far as phones and service.,"""2024-01-30T17:08:58.000Z""",0,2
pfbid084UBBASEMevU7TSXEqFr8gzKjb2L9sXSYgNt7djhdxyVbuMFJxgeTATMepAVb8d2l,Why can't you just install security updates and not install apps that I didn't ask for or want? I guess you must get kickbacks from the games or Verizon actually owns them.,"""2024-01-12T21:37:42.000Z""",0,2
